fitxer,titol,text_original,text_len_chars,n_tokens_A_python,n_tokens_B_spacy,exemple_20_tokens_A,exemple_20_tokens_B,tokens_A_python,tokens_B_spacy
Cultura.html,Hitchcock en l’era de la intel·ligència artificial,"La premissa argumental deSin piedadsembla evocar el somni humit de l’autoritarisme de Donald Trump. En un futur pròxim, uns Estats Units agitats per la criminalitat i les revoltes cíviques decideixen posar el sistema judicial en mans d’una intel·ligència artificial que promet eficàcia i, sobretot, rapidesa. Tot va sobre rodes fins que el principal promotor d’aquest sistema (un agent de policia interpretat per Chris Pratt) és acusat de l’assassinat de la seva dona i té noranta minuts per convèncer la IA (a qui posa cara la infal·lible Rebecca Ferguson) perquè no l’executi.  A partir d’aquest suggeridor punt de partida, el guionista Marco van Belle dissenya un refrescant còctel d’elements provinents de l’univers d’Alfred Hitchcock, des de la idea del fals culpable fins al voyeur paralitzat deLa finestra indiscreta–el protagonista deSin piedadha de provar la seva innocència explorant una pila de “finestres” virtuals des d’un terrorífic seient dels acusats–. Per la seva banda, el director rus Timur Bekmambetov (responsable delremakedeBen-Hur) accepta el difícil repte de generar interès i excitació amb els residus audiovisuals del món digital: videotrucades, missatgeria instantània, càmeres de videovigilància... I si la proposta acaba funcionant és gràcies a la negativa del film a caure en el maniqueisme en l’estudi de la confrontació entre la moralitat humana i l’objectivitat de la IA.",1456,219,124,hitchcock en lera de la intelligència artificial la premissa argumental desin piedadsembla evocar el somni humit de lautoritarisme de donald,hitchcock artificial premissa argumental desin piedadsemblar evocar somni humit autoritarisme donald trump futur pròxim estats units agitat criminalitat revolta cívic,hitchcock en lera de la intelligència artificial la premissa argumental desin piedadsembla evocar el somni humit de lautoritarisme de donald trump en un futur pròxim uns estats units agitats per la criminalitat i les revoltes cíviques decideixen posar el sistema judicial en mans duna intelligència artificial que promet eficàcia i sobretot rapidesa tot va sobre rodes fins que el principal promotor daquest sistema un agent de policia interpretat per chris pratt és acusat de lassassinat de la seva dona i té noranta minuts per convèncer la ia a qui posa cara la infallible rebecca ferguson perquè no lexecuti a partir daquest suggeridor punt de partida el guionista marco van belle dissenya un refrescant còctel delements provinents de lunivers dalfred hitchcock des de la idea del fals culpable fins al voyeur paralitzat dela finestra indiscretael protagonista desin piedadha de provar la seva innocència explorant una pila de finestres virtuals des dun terrorífic seient dels acusats per la seva banda el director rus timur bekmambetov responsable delremakedebenhur accepta el difícil repte de generar interès i excitació amb els residus audiovisuals del món digital videotrucades missatgeria instantània càmeres de videovigilància i si la proposta acaba funcionant és gràcies a la negativa del film a caure en el maniqueisme en lestudi de la confrontació entre la moralitat humana i lobjectivitat de la ia,hitchcock artificial premissa argumental desin piedadsemblar evocar somni humit autoritarisme donald trump futur pròxim estats units agitat criminalitat revolta cívic decidir posar sistema judicial mà artificial prometre eficàcia rapidesa roda principal promotor sistema agent policia interpretat chris pratt acusat assassinat dona tenir noranta minut convèncer ia posar cara rebecca ferguson executi partir suggeridor punt partida guionista marco belle dissenyar refrescant còctel element provinent univers alfred hitchcock idea de fals culpable el voyeur paralitzat dela finestrar protagonist desin piedadha provar innocència explorar pila finestra virtual terrorífic seient de banda director rus timur bekmambetov responsable acceptar difícil repte generar interès excitació residu audiovisual de món digital videotrucades missatgeria instantani càmera videovigilància proposta acabar funcionar gràcia negativa de film caure maniqueisme estudi confrontació moralitat humà objectivitat ia
Economia.html,L'atur repunta una mica però registra la xifra més baixa d'un gener des del 2008,"L’atur ha estrenat l’any amb un lleuger repunt, del 0,6%, respecte del desembre, però la xifra actual de desocupats –325.214– és la més baixa en un mes de gener des del 2008. En variació interanual, a més, ha baixat un 3,4%. El lleuger repunt del gener respecte de desembre es deu gairebé exclusivament al sector serveis, que engreixa les llistes d’aturats en més de 2.500 persones, un 1,1% més, informa l’ACN. Pel que fa a l’evolució interanual, el sector serveis es torna a mostrar menys dinàmic que la resta, amb una caiguda els darrers dotze mesos del 2,9%, lluny de les baixades que voregen el 10% a l’agricultura i la construcció, i de més del 5% en el sector de la construcció.  Pel que fa a les afiliacions a la Seguretat Social, s’han situat en els 3,82 milions. La xifra representa gairebé un 2% més que fa un any i és la millor registrada en un mes de gener des de, com a mínim, el 2012.",980,168,79,latur repunta una mica però registra la xifra més baixa dun gener des del latur ha estrenat lany amb un,atur repuntar mica registrar xifra baix gener de atur estrenar any lleuger repunt de respecte de desembre xifra actual desocupat,latur repunta una mica però registra la xifra més baixa dun gener des del latur ha estrenat lany amb un lleuger repunt del respecte del desembre però la xifra actual de desocupats és la més baixa en un mes de gener des del en variació interanual a més ha baixat un el lleuger repunt del gener respecte de desembre es deu gairebé exclusivament al sector serveis que engreixa les llistes daturats en més de persones un més informa lacn pel que fa a levolució interanual el sector serveis es torna a mostrar menys dinàmic que la resta amb una caiguda els darrers dotze mesos del lluny de les baixades que voregen el a lagricultura i la construcció i de més del en el sector de la construcció pel que fa a les afiliacions a la seguretat social shan situat en els milions la xifra representa gairebé un més que fa un any i és la millor registrada en un mes de gener des de com a mínim el,atur repuntar mica registrar xifra baix gener de atur estrenar any lleuger repunt de respecte de desembre xifra actual desocupat baix mes gener de variació interanual baixar lleuger repunt de gener respecte desembre deure exclusivament el sector servei engreixar llista aturat persona informar acn evolució interanual sector servei tornar mostrar menys dinàmic resta caiguda darrer dotze mes de lluny baixada voregar agricultura construcció de sector construcció afiliació seguretat social situar milió xifra representar any millor registrat mes gener mínim
Esports.html,"Alex Moreno, un nou contratemps al Girona","Contratemps important pel Girona: Alex Moreno pateix una lesió al soli de la cama esquerra que el podria tenir més d’un mes fora de la competició, a l’espera que el club ho faci oficial. El lateral es va fer mal a inicis d’aquesta setmana durant un entrenament i, de moment, encara no hi ha cap comunicat mèdic oficial per acabar de veure l’abast real. S’espera que siguin unes sis setmanes de baixa.  La seva absència deixa el Girona sense un lateral esquerre pur a la plantilla, una de les posicions que el club volia reforçar durant el mercat d’hivern i que finalment no ha pogut cobrir. Míchel haurà de recórrer a alternatives com Blind, Arnau o Francès per tapar un buit important a l’equip.",739,131,70,alex moreno un nou contratemps al girona contratemps important pel girona alex moreno pateix una lesió al soli de la,alex moreno nou contratemps el girona contratemps important per girona alex moreno patir lesió el soli cama esquerre poder mes,alex moreno un nou contratemps al girona contratemps important pel girona alex moreno pateix una lesió al soli de la cama esquerra que el podria tenir més dun mes fora de la competició a lespera que el club ho faci oficial el lateral es va fer mal a inicis daquesta setmana durant un entrenament i de moment encara no hi ha cap comunicat mèdic oficial per acabar de veure labast real sespera que siguin unes sis setmanes de baixa la seva absència deixa el girona sense un lateral esquerre pur a la plantilla una de les posicions que el club volia reforçar durant el mercat dhivern i que finalment no ha pogut cobrir míchel haurà de recórrer a alternatives com blind arnau o francès per tapar un buit important a lequip,alex moreno nou contratemps el girona contratemps important per girona alex moreno patir lesió el soli cama esquerre poder mes competició esperar club fer oficial lateral inici setmana entrenament moment cap comunicat mèdic oficial acabar veure abast real esperar ser sis setmana baixa absència deixar girona lateral esquerre pur plantilla posició club voliar reforçar mercat hivern finalment poder cobrir míchel haver recórrer alternativa blind arnau francès tapar buit important equip
Salut.html,L'Hospital Vall d’Hebron fa el primer trasplantament de cara del món amb una donant que havia rebut l'eutanàsia,"L’Hospital Universitari Vall d’Hebron ha fet el primer trasplantament de cara del món amb una donant a qui se li va aplicar l’eutanàsia. Un centenar de professionals van intervenir en el trasplantament parcial de cara, una operació de màxima complexitat amb tècniques de microcirurgia vasculonerviosa que va durar aproximadament vint-i-quatre hores. En la presentació d’aquesta fita, la directora assistencial,María José Abadías, ha destacat “la generositat extraordinària de la donant”, l’esforç col·lectiu rere l’operació i l’orgull que significava per a l’hospital, la sanitat pública i la societat. La Vall d’Hebron ha realitzat tres trasplantaments facials dels cinquanta-quatre que s’han fet fins ara al món.  “Avui sóc aquí per a donar les gràcies”, ha començat la intervenció la Carme, la dona que ha rebut el trasplantament de cara, concretament de la part central després d’haver tingut una necrosi dels teixits facials per una infecció bacteriològica arran d’una picada d’insecte fa dos anys, que la va dur a l’UCI. Quan en va sortir, la necrosi li havia desfigurat la cara i no podia menjar ni respirar bé. “Ara la meva vida comença a ser una mica millor […]. Després de quatre mesos, ja parlo, ja menjo, ja bec”, ha expressat davant una sala d’actes plena de professionals sanitaris i periodistes atrets per la presentació d’aquesta operació pionera. “A vegades trobes una llum que et permet de tirar endavant”, ha dit la Carme, que ha insistit a mostrar la gratitud a tot l’equip de la Vall d’Hebron i, sobretot, a la donant i a la seva família.  La desfiguració facial és una discapacitat que causa moltes dificultats en activitats tan quotidianes i essencials com ara parlar o menjar, a més de tenir un impacte psicològic i social greu. El trasplantament de cara és una cirurgia funcional que es realitza quan el pacient ha perdut, per exemple, els músculs orbiculars o els ulls i no es poden restituir amb unes altres tècniques quirúrgiques habituals de cirurgia plàstica. Els receptors són pacients amb desfiguració facial greu a conseqüència de malalties, cremades, traumatismes o defectes congènits que afecten funcions vitals bàsiques. “No es tracta només de col·locar teixits tous per donar una aparença normal, això seria un fracàs. L’operació es fa per aportar al pacient funcions i sensibilitat. Un trasplantament de cara amb el qual el receptor no hi pugui sentir ni moure res no és sinó una màscara. Parlem d’estructures amb tota mena de teixits, amb músculs i nervis, alguns dels quals amb diàmetres de 0,2 mil·límetres, que s’han de trobar i connectar”, ha recalcat el doctorJoan-Pere Barret, cap del Servei de Cirurgia Plàstica i Cremats de l’Hospital Vall d’Hebron.  La llei d’eutanàsia, que va entrar en vigor el juny del 2021, va obrir una nova possibilitat en els trasplantaments i també en va canviar una mica el paradigma, perquè els coordinadors dels programes es poden entrevistar amb el possible donant a casa. En el cas d’aquest trasplantament concret, com que la donant havia rebut l’autorització de la prestació d’ajut per a morir (PRAM), els responsables de l’operació van poder fer-ne una planificació més acurada. El trasplantament també ha estat el primer del món que ha disposat d’una planificació en 3D tant de la donant com de la receptora.  La donant era una dona que havia sol·licitat l’eutanàsia i que havia expressat la voluntat de donar el seu cos, inclosa la cara. Ella mateixa va parlar amb l’equip mèdic. “No hi ha paraules per a expressar la intensitat emocional i magnitud del moment. L’única cosa que volia la donant era saber si podia donar la cara. I la resposta era afirmativa. Va expressar l’absoluta felicitat de poder ajudar algú altre”, han explicat els responsables del procés, que n’han destacat “la concentració d’amor i generositat pels altres”.  Molt pocs centres al món poden fer trasplantaments de cara, una operació que es valora cas a cas. Cal que sigui un hospital terciari, universitari, amb molta experiència en trasplantaments i recursos assistencials i de laboratori dia i nit. Un centenar de professionals participen en cada trasplantament de cara, entre metges, infermeres, auxiliars d’infermeria i zeladors, a més de psicòlegs. L’operació implica molts serveis, com ara cirurgia plàstica i microcirurgia reparadora, trasplantament, immunologia, laboratoris, psiquiatria i psicologia clínica, rehabilitació, cures intensives i anatomia patològica.  Donant i receptor del trasplantament de cara han de compartir sexe i grup sanguini i presentar unes mesures antropomòrfiques del cap semblants. S’avalua amb entrevistes si el candidat compleix els criteris de la intervenció, més enllà dels estrictament mèdics, com ara l’estat cognitiu, la capacitat d’adaptació, les expectatives i l’adherència al tractament o el suport social i familiar.  Amb tots els informes, el candidat és avaluat pel Comitè d’Ètica Assistencial i el Comitè de Direcció Assistencial de la Vall d’Hebron; després, la Coordinació de Donació i Trasplantaments de l’hospital eleva el procediment a l’Organització Nacional de Trasplantaments espanyola (ONT) i l’Organització Catalana de Trasplantaments (OCATT), que és qui l’acaba autoritzant.",5306,829,431,lhospital vall dhebron fa el primer trasplantament de cara del món amb una donant que havia rebut leutanàsia lhospital universitari,hospital vall hebron trasplantament cara de món donant rebre eutanàsia hospital universitari vall hebron fer trasplantament cara de món donant,lhospital vall dhebron fa el primer trasplantament de cara del món amb una donant que havia rebut leutanàsia lhospital universitari vall dhebron ha fet el primer trasplantament de cara del món amb una donant a qui se li va aplicar leutanàsia un centenar de professionals van intervenir en el trasplantament parcial de cara una operació de màxima complexitat amb tècniques de microcirurgia vasculonerviosa que va durar aproximadament vintiquatre hores en la presentació daquesta fita la directora assistencialmaría josé abadías ha destacat la generositat extraordinària de la donant lesforç collectiu rere loperació i lorgull que significava per a lhospital la sanitat pública i la societat la vall dhebron ha realitzat tres trasplantaments facials dels cinquantaquatre que shan fet fins ara al món avui sóc aquí per a donar les gràcies ha començat la intervenció la carme la dona que ha rebut el trasplantament de cara concretament de la part central després dhaver tingut una necrosi dels teixits facials per una infecció bacteriològica arran duna picada dinsecte fa dos anys que la va dur a luci quan en va sortir la necrosi li havia desfigurat la cara i no podia menjar ni respirar bé ara la meva vida comença a ser una mica millor després de quatre mesos ja parlo ja menjo ja bec ha expressat davant una sala dactes plena de professionals sanitaris i periodistes atrets per la presentació daquesta operació pionera a vegades trobes una llum que et permet de tirar endavant ha dit la carme que ha insistit a mostrar la gratitud a tot lequip de la vall dhebron i sobretot a la donant i a la seva família la desfiguració facial és una discapacitat que causa moltes dificultats en activitats tan quotidianes i essencials com ara parlar o menjar a més de tenir un impacte psicològic i social greu el trasplantament de cara és una cirurgia funcional que es realitza quan el pacient ha perdut per exemple els músculs orbiculars o els ulls i no es poden restituir amb unes altres tècniques quirúrgiques habituals de cirurgia plàstica els receptors són pacients amb desfiguració facial greu a conseqüència de malalties cremades traumatismes o defectes congènits que afecten funcions vitals bàsiques no es tracta només de collocar teixits tous per donar una aparença normal això seria un fracàs loperació es fa per aportar al pacient funcions i sensibilitat un trasplantament de cara amb el qual el receptor no hi pugui sentir ni moure res no és sinó una màscara parlem destructures amb tota mena de teixits amb músculs i nervis alguns dels quals amb diàmetres de millímetres que shan de trobar i connectar ha recalcat el doctorjoanpere barret cap del servei de cirurgia plàstica i cremats de lhospital vall dhebron la llei deutanàsia que va entrar en vigor el juny del va obrir una nova possibilitat en els trasplantaments i també en va canviar una mica el paradigma perquè els coordinadors dels programes es poden entrevistar amb el possible donant a casa en el cas daquest trasplantament concret com que la donant havia rebut lautorització de la prestació dajut per a morir pram els responsables de loperació van poder ferne una planificació més acurada el trasplantament també ha estat el primer del món que ha disposat duna planificació en 3d tant de la donant com de la receptora la donant era una dona que havia sollicitat leutanàsia i que havia expressat la voluntat de donar el seu cos inclosa la cara ella mateixa va parlar amb lequip mèdic no hi ha paraules per a expressar la intensitat emocional i magnitud del moment lúnica cosa que volia la donant era saber si podia donar la cara i la resposta era afirmativa va expressar labsoluta felicitat de poder ajudar algú altre han explicat els responsables del procés que nhan destacat la concentració damor i generositat pels altres molt pocs centres al món poden fer trasplantaments de cara una operació que es valora cas a cas cal que sigui un hospital terciari universitari amb molta experiència en trasplantaments i recursos assistencials i de laboratori dia i nit un centenar de professionals participen en cada trasplantament de cara entre metges infermeres auxiliars dinfermeria i zeladors a més de psicòlegs loperació implica molts serveis com ara cirurgia plàstica i microcirurgia reparadora trasplantament immunologia laboratoris psiquiatria i psicologia clínica rehabilitació cures intensives i anatomia patològica donant i receptor del trasplantament de cara han de compartir sexe i grup sanguini i presentar unes mesures antropomòrfiques del cap semblants savalua amb entrevistes si el candidat compleix els criteris de la intervenció més enllà dels estrictament mèdics com ara lestat cognitiu la capacitat dadaptació les expectatives i ladherència al tractament o el suport social i familiar amb tots els informes el candidat és avaluat pel comitè dètica assistencial i el comitè de direcció assistencial de la vall dhebron després la coordinació de donació i trasplantaments de lhospital eleva el procediment a lorganització nacional de trasplantaments espanyola ont i lorganització catalana de trasplantaments ocatt que és qui lacaba autoritzant,hospital vall hebron trasplantament cara de món donant rebre eutanàsia hospital universitari vall hebron fer trasplantament cara de món donant se aplicar eutanàsia centenar professional intervenir trasplantament parcial cara operació màxim complexitat tècnica microcirurgia vasculonervios durar aproximadament hora presentació fita director assistencial maría josé abadías destacar generositat extraordinari donant esforç rere operació orgull significar hospital sanitat públic societat vall hebron realitzar tres trasplantament facial de fer ara el món avui donar gràcia començar intervenció carme dona rebre trasplantament cara concretament part central tenir necrosi de teixit facial infecció bacteriològic arran picada insecte dos any dur uci sortir necrosi desfigurar cara poder menjar respirar ara vida començar mica millor quatre mes parlar menjo bec expressar davant sala acte ple professional sanitari periodista atret presentació operació pioner vegada trobar llum permetre tirar endavant dir carme insistir mostrar gratitud equip vall hebron donant família desfiguració facial discapacitat causar dificultat activitat quotidià essencial ara parlar menjar impacte psicològic social greu trasplantament cara cirurgia funcional realitzar pacient perdre exemple múscul orbicular ull restituir tècnica quirúrgic habitual cirurgia plàstic receptor pacient desfiguració facial greu conseqüència malaltia cremat traumatisme defecte congènit afectar funció vital bàsic tractar teixit tou donar aparença normal ser fracàs operació aportar el pacient funcions sensibilitat trasplantament cara receptor poder sentir moure res sinó màscara parlar estructura mena teixit múscul nervi de diàmetre trobar connectar recalcar barret cap de servei cirurgia plàstica cremats hospital vall hebron llei eutanàsia entrar vigor juny de obrir nou possibilitat trasplantament canviar mica paradigma coordinador de programa entrevistar possible donar casa cas trasplantament concret donar rebre autorització prestació ajut morir pram responsable operació planificació acurat trasplantament de món disposar planificació donant receptor donar dona eutanàsia expressar voluntat donar cos inclosar cara ell parlar equip mèdic paraula expressar intensitat emocional magnitud de moment únic cosa voliar donar poder donar cara resposta afirmatiu expressar absolut felicitat ajudar algú explicar responsable de procés destacar concentració amor generositat per centre el món trasplantament cara operació valorar cas cas caldre ser hospital terciari universitari experiència trasplantament recurs assistencial laboratori dia nit centenar professional participar trasplantament cara metge infermer auxiliar infermeria zelador psicòleg operació implicar servei ara cirurgia plàstic microcirurgia reparador trasplantament immunologia laboratori psiquiatria psicologia clínic rehabilitació cura intensiu anatomia patològic donar receptor de trasplantament cara compartir sexe grup sanguini presentar mesura antropomòrfic de cap avalu entrevista candidat complir criteri intervenció enllà de estrictament mèdic ara cognitiu capacitat adaptació expectativa adherènciar el tractament suport social familiar informe candidat avaluat per comitè ètica assistencial comitè direcció assistencial vall hebron coordinació donació trasplantaments hospital elevar procediment organització nacional trasplantaments espanyol ont organització catalana trasplantaments ocatt acabar autoritzar
